{
  "components": [
    {
      "compatibility": {},
      "created_on": null,
      "details": {
        "schema": "skill"
      },
      "domain": null,
      "functional_role": null,
      "id": "component_de6ab94e",
      "name": "demo-skill",
      "naming_history": [
        {
          "evidence": [
            "skills/demo-skill"
          ],
          "name": "demo-skill",
          "reason": "Current name at inventory bootstrap.",
          "valid_from": "2026-08-29",
          "valid_to": null
        }
      ],
      "path": "skills/demo-skill",
      "provenance": {
        "license": "MIT",
        "notes": "Skill logic adapted from acme-example-tools' 'demo-skill' module at the cited commit; license text preserved in THIRD_PARTY_NOTICES.md. This is a synthetic/hypothetical example constructed for a plugin-inventory test, not a real ported component.",
        "origin": "Ported from open-source project acme-example-tools (https://github.com/example-org/acme-example-tools), commit a1b2c3d4e5f6789012345678901234567890abcd"
      },
      "score": null,
      "scoring_history": [],
      "security_score": null,
      "security_scoring_history": [],
      "status": "active",
      "status_history": [
        {
          "evidence": [
            "skills/demo-skill"
          ],
          "reason": "Discovered by plugin-inventory Build/Plan.",
          "status": "active",
          "valid_from": "2026-08-29",
          "valid_to": null
        }
      ],
      "type": "skill"
    }
  ],
  "extensions": {},
  "plugin_id": "fixture-demo-plugin",
  "plugin_name": "Fixture Demo Plugin",
  "schema_version": "1.0.0",
  "updated_on": "2026-08-29"
}
